{
  "schemaVersion": "2",
  "unit": "mm",
  "apertures": [
    {
      "code": 10,
      "shape": {
        "type": "rectangle",
        "width": 1.3,
        "height": 4.0
      }
    },
    {
      "code": 11,
      "shape": {
        "type": "rectangle",
        "width": 4.0,
        "height": 1.3
      }
    },
    {
      "code": 12,
      "shape": {
        "type": "rectangle",
        "width": 1.4,
        "height": 2.2
      }
    },
    {
      "code": 13,
      "shape": {
        "type": "rectangle",
        "width": 3.0,
        "height": 4.0
      }
    },
    {
      "code": 14,
      "shape": {
        "type": "circle",
        "diameter": 2.4
      }
    }
  ],
  "objects": [
    {
      "kind": "flash",
      "polarity": "dark",
      "aperture": 10,
      "at": {
        "x": 31.65,
        "y": 28.0
      },
      "sourceOffset": 142
    },
    {
      "kind": "flash",
      "polarity": "dark",
      "aperture": 10,
      "at": {
        "x": 31.65,
        "y": 72.0
      },
      "sourceOffset": 166
    },
    {
      "kind": "flash",
      "polarity": "dark",
      "aperture": 11,
      "at": {
        "x": 27.0,
        "y": 32.65
      },
      "sourceOffset": 190
    },
    {
      "kind": "flash",
      "polarity": "dark",
      "aperture": 11,
      "at": {
        "x": 72.0,
        "y": 32.65
      },
      "sourceOffset": 214
    },
    {
      "kind": "flash",
      "polarity": "dark",
      "aperture": 10,
      "at": {
        "x": 35.05,
        "y": 28.0
      },
      "sourceOffset": 238
    },
    {
      "kind": "flash",
      "polarity": "dark",
      "aperture": 10,
      "at": {
        "x": 35.05,
        "y": 72.0
      },
      "sourceOffset": 262
    },
    {
      "kind": "flash",
      "polarity": "dark",
      "aperture": 11,
      "at": {
        "x": 27.0,
        "y": 35.75
      },
      "sourceOffset": 286
    },
    {
      "kind": "flash",
      "polarity": "dark",
      "aperture": 11,
      "at": {
        "x": 72.0,
        "y": 35.75
      },
      "sourceOffset": 310
    },
    {
      "kind": "flash",
      "polarity": "dark",
      "aperture": 10,
      "at": {
        "x": 38.45,
        "y": 28.0
      },
      "sourceOffset": 334
    },
    {
      "kind": "flash",
      "polarity": "dark",
      "aperture": 10,
      "at": {
        "x": 38.45,
        "y": 72.0
      },
      "sourceOffset": 358
    },
    {
      "kind": "flash",
      "polarity": "dark",
      "aperture": 11,
      "at": {
        "x": 27.0,
        "y": 38.85
      },
      "sourceOffset": 382
    },
    {
      "kind": "flash",
      "polarity": "dark",
      "aperture": 11,
      "at": {
        "x": 72.0,
        "y": 38.85
      },
      "sourceOffset": 406
    },
    {
      "kind": "flash",
      "polarity": "dark",
      "aperture": 10,
      "at": {
        "x": 41.85,
        "y": 28.0
      },
      "sourceOffset": 430
    },
    {
      "kind": "flash",
      "polarity": "dark",
      "aperture": 10,
      "at": {
        "x": 41.85,
        "y": 72.0
      },
      "sourceOffset": 454
    },
    {
      "kind": "flash",
      "polarity": "dark",
      "aperture": 11,
      "at": {
        "x": 27.0,
        "y": 41.95
      },
      "sourceOffset": 478
    },
    {
      "kind": "flash",
      "polarity": "dark",
      "aperture": 11,
      "at": {
        "x": 72.0,
        "y": 41.95
      },
      "sourceOffset": 502
    },
    {
      "kind": "flash",
      "polarity": "dark",
      "aperture": 10,
      "at": {
        "x": 45.25,
        "y": 28.0
      },
      "sourceOffset": 526
    },
    {
      "kind": "flash",
      "polarity": "dark",
      "aperture": 10,
      "at": {
        "x": 45.25,
        "y": 72.0
      },
      "sourceOffset": 550
    },
    {
      "kind": "flash",
      "polarity": "dark",
      "aperture": 11,
      "at": {
        "x": 27.0,
        "y": 45.05
      },
      "sourceOffset": 574
    },
    {
      "kind": "flash",
      "polarity": "dark",
      "aperture": 11,
      "at": {
        "x": 72.0,
        "y": 45.05
      },
      "sourceOffset": 598
    },
    {
      "kind": "flash",
      "polarity": "dark",
      "aperture": 10,
      "at": {
        "x": 48.65,
        "y": 28.0
      },
      "sourceOffset": 622
    },
    {
      "kind": "flash",
      "polarity": "dark",
      "aperture": 10,
      "at": {
        "x": 48.65,
        "y": 72.0
      },
      "sourceOffset": 646
    },
    {
      "kind": "flash",
      "polarity": "dark",
      "aperture": 11,
      "at": {
        "x": 27.0,
        "y": 48.15
      },
      "sourceOffset": 670
    },
    {
      "kind": "flash",
      "polarity": "dark",
      "aperture": 11,
      "at": {
        "x": 72.0,
        "y": 48.15
      },
      "sourceOffset": 694
    },
    {
      "kind": "flash",
      "polarity": "dark",
      "aperture": 10,
      "at": {
        "x": 52.05,
        "y": 28.0
      },
      "sourceOffset": 718
    },
    {
      "kind": "flash",
      "polarity": "dark",
      "aperture": 10,
      "at": {
        "x": 52.05,
        "y": 72.0
      },
      "sourceOffset": 742
    },
    {
      "kind": "flash",
      "polarity": "dark",
      "aperture": 11,
      "at": {
        "x": 27.0,
        "y": 51.25
      },
      "sourceOffset": 766
    },
    {
      "kind": "flash",
      "polarity": "dark",
      "aperture": 11,
      "at": {
        "x": 72.0,
        "y": 51.25
      },
      "sourceOffset": 790
    },
    {
      "kind": "flash",
      "polarity": "dark",
      "aperture": 10,
      "at": {
        "x": 55.45,
        "y": 28.0
      },
      "sourceOffset": 814
    },
    {
      "kind": "flash",
      "polarity": "dark",
      "aperture": 10,
      "at": {
        "x": 55.45,
        "y": 72.0
      },
      "sourceOffset": 838
    },
    {
      "kind": "flash",
      "polarity": "dark",
      "aperture": 11,
      "at": {
        "x": 27.0,
        "y": 54.35
      },
      "sourceOffset": 862
    },
    {
      "kind": "flash",
      "polarity": "dark",
      "aperture": 11,
      "at": {
        "x": 72.0,
        "y": 54.35
      },
      "sourceOffset": 886
    },
    {
      "kind": "flash",
      "polarity": "dark",
      "aperture": 10,
      "at": {
        "x": 58.85,
        "y": 28.0
      },
      "sourceOffset": 910
    },
    {
      "kind": "flash",
      "polarity": "dark",
      "aperture": 10,
      "at": {
        "x": 58.85,
        "y": 72.0
      },
      "sourceOffset": 934
    },
    {
      "kind": "flash",
      "polarity": "dark",
      "aperture": 11,
      "at": {
        "x": 27.0,
        "y": 57.45
      },
      "sourceOffset": 958
    },
    {
      "kind": "flash",
      "polarity": "dark",
      "aperture": 11,
      "at": {
        "x": 72.0,
        "y": 57.45
      },
      "sourceOffset": 982
    },
    {
      "kind": "flash",
      "polarity": "dark",
      "aperture": 10,
      "at": {
        "x": 62.25,
        "y": 28.0
      },
      "sourceOffset": 1006
    },
    {
      "kind": "flash",
      "polarity": "dark",
      "aperture": 10,
      "at": {
        "x": 62.25,
        "y": 72.0
      },
      "sourceOffset": 1030
    },
    {
      "kind": "flash",
      "polarity": "dark",
      "aperture": 11,
      "at": {
        "x": 27.0,
        "y": 60.55
      },
      "sourceOffset": 1054
    },
    {
      "kind": "flash",
      "polarity": "dark",
      "aperture": 11,
      "at": {
        "x": 72.0,
        "y": 60.55
      },
      "sourceOffset": 1078
    },
    {
      "kind": "flash",
      "polarity": "dark",
      "aperture": 10,
      "at": {
        "x": 65.65,
        "y": 28.0
      },
      "sourceOffset": 1102
    },
    {
      "kind": "flash",
      "polarity": "dark",
      "aperture": 10,
      "at": {
        "x": 65.65,
        "y": 72.0
      },
      "sourceOffset": 1126
    },
    {
      "kind": "flash",
      "polarity": "dark",
      "aperture": 11,
      "at": {
        "x": 27.0,
        "y": 63.65
      },
      "sourceOffset": 1150
    },
    {
      "kind": "flash",
      "polarity": "dark",
      "aperture": 11,
      "at": {
        "x": 72.0,
        "y": 63.65
      },
      "sourceOffset": 1174
    },
    {
      "kind": "flash",
      "polarity": "dark",
      "aperture": 10,
      "at": {
        "x": 69.05,
        "y": 28.0
      },
      "sourceOffset": 1198
    },
    {
      "kind": "flash",
      "polarity": "dark",
      "aperture": 10,
      "at": {
        "x": 69.05,
        "y": 72.0
      },
      "sourceOffset": 1222
    },
    {
      "kind": "flash",
      "polarity": "dark",
      "aperture": 11,
      "at": {
        "x": 27.0,
        "y": 66.75
      },
      "sourceOffset": 1246
    },
    {
      "kind": "flash",
      "polarity": "dark",
      "aperture": 11,
      "at": {
        "x": 72.0,
        "y": 66.75
      },
      "sourceOffset": 1270
    },
    {
      "kind": "flash",
      "polarity": "dark",
      "aperture": 12,
      "at": {
        "x": 12.7,
        "y": 16.1
      },
      "sourceOffset": 1294
    },
    {
      "kind": "flash",
      "polarity": "dark",
      "aperture": 12,
      "at": {
        "x": 12.7,
        "y": 22.1
      },
      "sourceOffset": 1318
    },
    {
      "kind": "flash",
      "polarity": "dark",
      "aperture": 12,
      "at": {
        "x": 15.4,
        "y": 16.1
      },
      "sourceOffset": 1342
    },
    {
      "kind": "flash",
      "polarity": "dark",
      "aperture": 12,
      "at": {
        "x": 15.4,
        "y": 22.1
      },
      "sourceOffset": 1366
    },
    {
      "kind": "flash",
      "polarity": "dark",
      "aperture": 12,
      "at": {
        "x": 18.1,
        "y": 16.1
      },
      "sourceOffset": 1390
    },
    {
      "kind": "flash",
      "polarity": "dark",
      "aperture": 12,
      "at": {
        "x": 18.1,
        "y": 22.1
      },
      "sourceOffset": 1414
    },
    {
      "kind": "flash",